name,email,role,department,skills,location
Gaurav Dasgupta,vickythakur6430@gmail.com,IN2,GBS_FINTECH,"Scala, java, spark, big data, Azure, Docker",BANGALORE
Amrita Kumari,shivam151990@gmail.com,IN3,GBS_FINTECH,"Scala, Kafka, ReactJS, JavaScript,CSS5,HTML5,Docker,Azure,Cloud Foundry,Jenkinss",BANGALORE
Rishika Modi,vickythakur6430@gmail.com,IN4,GBS_FINTECH,"Java, Spring, Kafka, Docker, Azure",BANGALORE
Akash Srivastava,vickythakur6430@gmail.com,IN5,GBS_FINTECH,"Scala,Haskell,ReasonML,ScalaJS,ReactJS,Azure,Cloud Foundry,Docker, Spark",BANGALORE
Satyawati Tripathi ,shivam151990@gmail.com,IN6,GBS_FINTECH,"Core Java, J2EE, Spring, Kafka, Azure, Git",BANGALORE
Rahul Jain,vickythakur6430@gmail.com,IN3,GBS_FINTECH,"Java, Spring, Kafka, Docker, Azure",BANGALORE